<?xml version="1.0" encoding="UTF-8"?>
<Hotel xmlns="http://github.com/kaarriet/Assignment4/"
       xmlns:xsi="http://www.w3.org/2001/XMLSchema-instance"
       xsi:schemaLocation="http://github.com/kaarriet/Assignment4/ Hotels.xsd">
    
    <Hotel>
        <Name>Westin</Name>
        <Address>
            <Number>11</Number>
            <Street>E 7th St</Street>
            <City>Tempe</City>
            <State>AZ</State>
            <Zip>85281</Zip>
        </Address>
        <Rating>4.2</Rating>
    </Hotel>

    <Hotel>
        <Name>Marriott</Name>
        <Name>DuplicateName</Name> <!-- Intentional error: duplicate Name elements -->
        <Address>
            <Number>123</Number>
            <Street>Main St</Street>
            <City>Phoenix</City>
            <State>AZ</State>
            <!-- Missing closing tag for Zip element -->
            <Zip>85004
        </Address>
        <Phone>602-555-1234</Phone>
    </Hotel>

</Hotel>