<?xml version="1.0" encoding="UTF-8"?>
<Hotels xmlns="http://github.com/kaarriet/Assignment4/"
        xmlns:xsi="http://www.w3.org/2001/XMLSchema-instance"
        xsi:schemaLocation="http://github.com/kaarriet/Assignment4/ Hotels.xsd">
    
    <Hotel NearbyAirport="Sky Harbor">
        <Name>Westin</Name>
        <Address>
            <Number>11</Number>
            <Street>E 7th St</Street>
            <City>Tempe</City>
            <State>AZ</State>
            <Zip>85281</Zip>
        </Address>
        <Phone type="primary">480-968-8885</Phone>
        <Phone type="tollfree">800-937-8461</Phone>
        <Rating>4.2</Rating>
    </Hotel>

    <Hotel NearbyAirport="Phoenix Airport">
        <Name>Marriott</Name>
        <Address>
            <Number>123</Number>
            <Street>Main St</Street>
            <City>Phoenix</City>
            <State>AZ</State>
            <Zip>85004</Zip>
        </Address>
        <Phone>602-555-1234</Phone>
    </Hotel>

    <!-- Add more hotel entries here, following the same structure -->
</Hotels>